{
      "drinkName"   : "Espresso Romano",
      "drinkFamily" : "Black Espresso",
      "drinkBlurb"  : "An espresso Romano is a shot of espresso with a slice of lemon served on the side. The lemon can be run along the rim of the cup as a way to accentuate the espresso's sweetness.",
      "drinkHotCold": "Hot",
      "drinkWikiURL": "https://en.wikipedia.org/wiki/List_of_coffee_drinks#Espresso_Romano"
}
